<?xml version="1.0" encoding="UTF-8"?>

<!DOCTYPE homepage [
<!ELEMENT root (worksheet,Row,CYBERSECURITY)>
<!ELEMENT worksheet (#CDATA)>
<ATTLIST worksheet name CDATA #FIXED "Sheet1">
<!ELEMENT Row (#CDATA)>
<<ATTLIST Row index CDATA #REQUIRED>
<!ELEMENT CYBERSECURITY (#CDATA)>
]

<root>
    <worksheet name="Sheet1">
        <Row index="4">
            <CYBERSECURITY>Overview Curriculum Prerequisites Instructor </CYBERSECURITY>
        </Row>
        <Row index="6">
            <CYBERSECURITY>COURSE OVERVIEW</CYBERSECURITY>
        </Row>
        <Row index="8"/>
        <Row index="9">
            <CYBERSECURITY>CURRICULUM</CYBERSECURITY>
        </Row>
        <Row index="11"/>
        <Row index="12">
            <CYBERSECURITY>PREREQUISITES</CYBERSECURITY>
        </Row>
        <Row index="15"/>
        <Row index="16">
            <CYBERSECURITY>INSTRUCTOR</CYBERSECURITY>
        </Row>
        <Row index="18">
            <CYBERSECURITY>Nathan House</CYBERSECURITY>
        </Row>
        <Row index="19">
            <CYBERSECURITY>-4.5 INSTRUCTOR RATINGS -73864 REVIEWS -324477 STUDENTS -7 COURSES</CYBERSECURITY>
        </Row>
        <Row index="20">
            <CYBERSECURITY>I am working as Computer Scientist at Adobe. I have 7 years of extensive experience in Programming. I am a Machine Learning enthusiast and have 4+ years of experience in Machine Learning.I am very passionate about learning the latest developments in Computer Vision and Machine Learning and like sharing my knowledge with others. </CYBERSECURITY>
        </Row>
    </worksheet>
</root>